id,title,score,date,num_comments
ll0n4p,"Need explanations on Level 2 data for GME, why isn’t the price higher if asks are only 4000$+",1,2021-02-16,2
ll0d5c,SAS = GME,1,2021-02-16,2
lkzzpj,Is anybody still holding onto GME?,1,2021-02-16,2
lkzzc4,Should I sell GameStop stock?,1,2021-02-16,2
lkzmms,Show is over for GME and AMC? What happened to all the posts and analysis?,1,2021-02-16,2
lkzdxt,XRT is being used to Hide GME Shorts,1,2021-02-16,2
lkzc2d,Robinhood Cofounder discussing GME with former SEC Chairman in one week,1,2021-02-16,0
lkzbcd,Robinhood Cofounder discussing GME with former SEC Chairman in one week,1,2021-02-16,0
lkyrje,WTF is up with XRT ETF and GME?,1,2021-02-16,2
lkymhe,🚀🔥🚀🔥$GME... If we come together we can!!! $GME One last time this Friday 2/19!!!!!!🔥🚀🔥🚀🔥 We like the stock!!!!!!!!!,1,2021-02-16,2
lkyeqs,"DOFSQ - Oil play, why obsess over GME?",1,2021-02-16,2
lky7wp,"This is no ""Yolo-GME-Rich-in-2-Weeks"" sorry. Lets talk about something i think could make some safe profit.",1,2021-02-16,0
lky2oe,Get your GME money back,1,2021-02-16,2
lky1jk,Tax Season: For those that lost huge on GME... you can enjoy a lifetime of capital loss curtesy of Uncle Sam,1,2021-02-16,2
lkxza2,GME Should Go Bankrupt,1,2021-02-16,0
lkxlj6,For all my fellow retards out there still holding GME.. is this Jim Cramer or Donye Wump?🤣🤣🤣,1,2021-02-16,0
lkxfs4,For all my fellow retards out there still holding GME is this Jim Cramer or Donye Wimp??,1,2021-02-16,0
lkxddf,To my GME folks,1,2021-02-16,0
lkx8o2,"AI generated DD for GME - says don't buy it - sorry.. love the movement, but... Its expensive; profitability is close to weak; street sentiment is close to a push; momentum is obliviously at a ridiculously high score but its a bubble.. survey says:",1,2021-02-16,2
lkx805,"“Trust me bro, GME 800C can not go tits up. Yes, mortgage your wife’s bf’s house”",1,2021-02-16,2
lkx6iq,"AI generated DD for GME - says don't buy it - sorry.. love the movement, but... Its expensive; profitability is close to weak; street sentiment is close to a push; momentum is obliviously at a ridiculously high score but its a bubble.. survey says:",1,2021-02-16,2
lkx67y,Is the squeeze squoze on GME?,1,2021-02-16,2
lkx60o,r/GME has some really good DD if you know what I Mean..,1,2021-02-16,2
lkx41j,"You thought this was Game of Markets, turns out it is just Hunger Games STONKS SAGA! How Citadel &amp; RH fucked over the GME squeeze by changing the rules of the game and no one gives a fuck about it and why Mark Cuban is RIGHT!",1,2021-02-16,30
lkwx0k,Billions of people around the world are buying or have bought at the VARY least 1 gme or amc. You expect me to believe the value of these stocks with the amount of money in them is what the stock market says right now!? Now that's funny. Anyone with a pittance worth of money should put it on this.,1,2021-02-16,2
lkwttd,This is insane!! Wonder why someone will donate you $$ when you gamble your life savings on GME.,1,2021-02-16,2
lkwsjw,Stroll into my local GameStop,1,2021-02-16,24
lkwkfj,GME day to moon,1,2021-02-16,0
lkwjyy,GME day to moon,1,2021-02-16,0
lkwhyg,"You can’t buy these street smarts, and the government won’t be taxing my three shares of $215-300 GME 💎 🚀 😂",1,2021-02-16,2
lkvpiz,GME to the moon 🖐💎🤚,1,2021-02-16,1
lkvogs,XRT is being used to hide GME shorts. XRT currently sits at 190% SHORT FLOAT. Peaking on 2/1 at over 800% SHORT FLOAT!!,1,2021-02-16,1
lkvhy9,"Mods are asleep, frontpage GME posts",1,2021-02-16,1
lkvh2i,xrt_is_being_used_to_hide_gme_shorts_xrt,1,2021-02-16,0
lkvfa5,WE ARE IN CONTROL. 🚀 WE HOLD THE AMMO BABY GME TO THE MOON,8,2021-02-16,6
lkvf89,"What will Grampa Warren’s pick be? PYPL, PLTR, DIS,GOOGL...GME?",1,2021-02-16,0
lkvf5q,"Mods are asleep, frontpage all GME posts",1,2021-02-16,1
lkveyk,"Don’t listen to these idiots. 18 year olds who just started investing are listening to this crap. Experienced investor here...YOU WILL LOSE MONEY. Get out now! Sell GME, AMC, NOK, NAKD, BB. You’ll be happy you did.",1,2021-02-16,1
lkvdqq,"Guys this entire page has been compromised by paid off ppl, join r/GME on the real news of what's going on. Major shit with XRT happening.",1,2021-02-16,1
lkvdp6,https://www.reddit.com/r/wallstreetbets/comments/lktxjx/xrt_is_being_used_to_hide_gme_shorts_xrt/?utm_source=share&amp;utm_medium=ios_app&amp;utm_name=iossmf,1,2021-02-16,1
lkvd70,Gme short data 2/12,1,2021-02-16,0
lkvbuj,Important information on GME!,1,2021-02-16,2
lkvbrz,Is XRT is being used to hide GME shorts?,30,2021-02-16,41
lkv9ev,About GME doom day and welcome to discuss,1,2021-02-16,0
lkv8v4,Check out top posts r/GME for XRT info,1,2021-02-16,1
lkv519,Check out r/GME for XRT info,1,2021-02-16,1
lkv45q,Help!? Should I sell my GME STOCK BEFORE I LOSE MORE $ OR HOLD?,1,2021-02-16,1
lkuynq,GME + AMC Partnership? Is it possible?,1,2021-02-16,0
lkuw3w,$$GAMR$$ is the ETF that has the most GME stock in it!,1,2021-02-16,1
lkuvd1,$GAMR$ is the ETF that has the most GME stock in it!,1,2021-02-16,1
lkutrk,GAMR is the ETF that has the most GME stock in it!,1,2021-02-16,1
lkuswb,GAMR is the ETF that has the most GME stock in it!,1,2021-02-16,1
lkur7k,Short volume and GME day to 🚀,1,2021-02-16,1
lkur3h,CLOV next GME?,1,2021-02-16,0
lkuqp6,About GME shorting HF doom day - welcome to discuss,1,2021-02-16,1
lkugk5,why not buy $gme on2.18 during the hearings?,1,2021-02-16,1
lkub6t,New Documentary about GameStop in the works,1,2021-02-16,0
lktxjx,XRT is being used to hide GME shorts. XRT currently sits at 190% SHORT FLOAT. Peaking on 2/1 at over 800% SHORT FLOAT!!,219,2021-02-16,434
lktx4u,Why Not Buy $GME during hearings?,1,2021-02-16,1
lktwjj,XRT is being used to hide GME shorts. XRT currently sits at 190% SHORT FLOAT. Peaking on 2/1 at over 800% SHORT FLOAT!!,1,2021-02-16,1
lktw77,155 shares of GME at an avg cost of $242 per. Down over 28k in 28 days.,1,2021-02-16,1
lkts7w,"XRT is short 180%, it has a large volume of Gamestop shares",1,2021-02-16,0
lktrhe,is XRT is being used to hide GME shorts?,86,2021-02-16,33
lktqsg,"“Hey, welcome to GameStop”",1,2021-02-16,1
lktpvm,"XRT shorted 180%, Has a large volume of GME",1,2021-02-16,0
lkto87,Gme. Moon. DD. Banana.,1,2021-02-16,1
lktnjt,Why is GME staying around $50?,1,2021-02-16,1
lktn4x,Gme moon bound !!,1,2021-02-16,1
lktmxy,XRT is being used to hide GME shorts. XRT currently sits at 190% SHORT FLOAT. Peaking on 2/1 at over 800% SHORT FLOAT!!,1,2021-02-16,0
lktkzn,GME dead?,1,2021-02-16,1
lkthyv,Is GME getting shorted by proxy?,13,2021-02-16,5
lkth85,I'm diamond handing $37k of GME already. Is there anything else worth YOLOing money into first thing tomorrow?,1,2021-02-16,1
lktenf,"Fellow Apes, I'm engraving GME to the moon in my graveyard. But ain't fkn selling. 💎 🙌",1,2021-02-16,0
lktele,GME Should Go Bankrupt,36,2021-02-16,804
lktc9s,"To be fair, you have to have a very high IQ to understand $GME",1,2021-02-16,1
lktc6b,"GME holders, don't get discouraged",37,2021-02-16,477
lkt8cb,"Where my by holders at??? GME at $350. Sorry about the low quality, i should be studying.",0,2021-02-16,2
lkt1ay,XRT is being used to hide GME shorts. XRT currently sits at 190% short float. Peaking on 2/1 at over 800% short float!,76,2021-02-16,53
lksxvc,XRT Shorts mapped to GME’s chart,1,2021-02-16,2
lksxnx,Day 3 of GameStop Hearing - Secondary Witnesses Called to Testify - House Committee of Financial Services,1,2021-02-16,4
lkswd2,XRT is being used to hide GME shorts. XRT currently sits at 190% short float. Peaking on 2/1 at over 800% short float!,1,2021-02-16,0
lksv64,XRT is being used to hide GME shorts. XRT currently sits at 190% SHORT FLOAT. Peaking on 2/1 at over 800% SHORT FLOAT!!,1,2021-02-16,0
